-- Basic Row-level Access Controls
-- ====================================
SELECT sepgsql_getcon();
                   sepgsql_getcon                    
-----------------------------------------------------
 unconfined_u:unconfined_r:unconfined_t:s0-s0:c0.c15
(1 row)

-- cleanup previous tests
SET client_min_messages TO 'error';
DROP TABLE IF EXISTS t2;
DROP TABLE IF EXISTS t1;
RESET client_min_messages;
CREATE TABLE t1
(
	a	int primary key,
	b	text
);
psql:sql/row_level_mac.init:18: NOTICE:  CREATE TABLE / PRIMARY KEY will create implicit index "t1_pkey" for table "t1"
CREATE TABLE t2
(
	x	int references t1(a),
	y	text
);
INSERT INTO t1 (security_label, a, b) VALUES
       ('system_u:object_r:sepgsql_table_t:s0',            1, 'aaa'),
       ('system_u:object_r:sepgsql_table_t:s0:c0',         2, 'bbb'),
       ('system_u:object_r:sepgsql_table_t:s0:c1',         3, 'ccc'),
       ('system_u:object_r:sepgsql_ro_table_t:s0',         4, 'ddd'),
       ('system_u:object_r:sepgsql_ro_table_t:s0:c0',      5, 'eee'),
       ('system_u:object_r:sepgsql_ro_table_t:s0:c1',      6, 'fff');
INSERT INTO t2 (x, y) VALUES
       (1, 'red'), (2, 'blue'), (3, 'yellow'),
       (4, 'green'), (5, 'orange'), (6, 'white');
UPDATE t2 SET security_label = sepgsql_set_range(security_label, 's0:c1')
       WHERE x IN (1, 3, 4)
-- Basic Row-level Access Controls
-- ====================================
SELECT sepgsql_getcon();
                  sepgsql_getcon                   
---------------------------------------------------
 unconfined_u:unconfined_r:sepgsql_test_t:s0-s0:c0
(1 row)

SELECT security_label, * FROM t1;
               security_label               | a |  b  
--------------------------------------------+---+-----
 system_u:object_r:sepgsql_table_t:s0       | 1 | aaa
 system_u:object_r:sepgsql_table_t:s0:c0    | 2 | bbb
 system_u:object_r:sepgsql_ro_table_t:s0    | 4 | ddd
 system_u:object_r:sepgsql_ro_table_t:s0:c0 | 5 | eee
(4 rows)

SELECT security_label, * FROM t2;
              security_label              | x |   y    
------------------------------------------+---+--------
 unconfined_u:object_r:sepgsql_table_t:s0 | 2 | blue
 unconfined_u:object_r:sepgsql_table_t:s0 | 5 | orange
 unconfined_u:object_r:sepgsql_table_t:s0 | 6 | white
(3 rows)

COPY t1 (security_label, a, b) TO stdout;
system_u:object_r:sepgsql_table_t:s0	1	aaa
system_u:object_r:sepgsql_table_t:s0:c0	2	bbb
system_u:object_r:sepgsql_ro_table_t:s0	4	ddd
system_u:object_r:sepgsql_ro_table_t:s0:c0	5	eee
COPY t2 (security_label, x, y) TO stdout;
unconfined_u:object_r:sepgsql_table_t:s0	2	blue
unconfined_u:object_r:sepgsql_table_t:s0	5	orange
unconfined_u:object_r:sepgsql_table_t:s0	6	white
SELECT t1.security_label, t2.security_label, * FROM t1 JOIN t2 ON t1.a = t2.x;
               security_label               |              security_label              | a |  b  | x |   y    
--------------------------------------------+------------------------------------------+---+-----+---+--------
 system_u:object_r:sepgsql_table_t:s0:c0    | unconfined_u:object_r:sepgsql_table_t:s0 | 2 | bbb | 2 | blue
 system_u:object_r:sepgsql_ro_table_t:s0:c0 | unconfined_u:object_r:sepgsql_table_t:s0 | 5 | eee | 5 | orange
(2 rows)

BEGIN;
UPDATE t1 SET b = b || '_updt';
SELECT security_label, * FROM t1;
               security_label               | a |    b     
--------------------------------------------+---+----------
 system_u:object_r:sepgsql_ro_table_t:s0    | 4 | ddd
 system_u:object_r:sepgsql_ro_table_t:s0:c0 | 5 | eee
 system_u:object_r:sepgsql_table_t:s0       | 1 | aaa_updt
 system_u:object_r:sepgsql_table_t:s0:c0    | 2 | bbb_updt
(4 rows)

ABORT;
BEGIN;
DELETE FROM t2 RETURNING *;
 x |   y    
---+--------
 2 | blue
 5 | orange
 6 | white
(3 rows)

ABORT;
INSERT INTO t1 VALUES (6, 'fff');	-- to be failed
psql:sql/row_level_mac.sql:23: ERROR:  duplicate key value violates unique constraint "t1_pkey"
DELETE FROM t1 WHERE a = 1;		-- to be failed
psql:sql/row_level_mac.sql:24: ERROR:  SELinux: security policy violation
CONTEXT:  SQL statement "SELECT 1 FROM ONLY "public"."t2" x WHERE $1 OPERATOR(pg_catalog.=) "x" FOR SHARE OF x"
